{
  "$schema": "../../schemas/config.schema.json",
  "targetVersion": "1.26.50",
  "namespace": "example_guides",
  "name": "@bedrock-core guides example",
  "authors": [],
  "packs": {
    "logic": "./packs/BP",
    "assets": "./packs/RP"
  },
  "bedrockCore": {
    "formatVersion": "1.0.0",
    "profiles": {
      "default": {
        "stages": {
          "guides": {
            "compileScreens": false
          }
        },
        "export": {
          "logic": "./dist/BP",
          "assets": "./dist/RP"
        }
      }
    }
  }
}
