{
  "$schema": "../../schemas/config.schema.json",
  "targetVersion": "1.26.50",
  "namespace": "builder_example",
  "name": "Script-only example",
  "authors": [],
  "packs": {
    "behaviorPack": "./packs/BP"
  },
  "bedrockCore": {
    "formatVersion": "1.0.0",
    "profiles": {
      "default": {
        "stages": {},
        "export": {
          "behaviorPack": "./dist/behaviorPack"
        },
        "debug": true
      },
      "tests": {
        "stages": {
          "manifest": {
            "manifestPath": "./packs/BP/manifest.test.json"
          }
        },
        "export": {
          "behaviorPack": "./dist/tests/behaviorPack"
        },
        "debug": true
      }
    }
  }
}
